{
  "schema": "history_go_people_claims_v1",
  "version": "1.0.0",
  "person_id": "johannes_brun",
  "profile_file": "data/people/scenekunst/oslo/bankplassen/johannes_brun.json",
  "identity": {
    "canonical_identity": "Johannes Finne Brun (1832–1890), den norske skuespilleren som arbeidet ved Christiania Theater og minnes med en statue på Bankplassen.",
    "name_variants": [
      "Johannes Brun",
      "Johannes Finne Brun"
    ],
    "not": [
      "Johan Nordahl Brun",
      "navnelike personer"
    ],
    "identity_status": "verified"
  },
  "claims": [
    {
      "id": "identity_and_lifespan",
      "claim": "Store norske leksikon identifiserer Johannes Brun som norsk skuespiller, født 10. mars 1832 og død 7. mars 1890.",
      "status": "verified",
      "source_url": "https://snl.no/Johannes_Brun",
      "source_location": "faktaboks og innledning",
      "source_type": "recognized_reference",
      "temporal_status": "historical",
      "verified_at": "2026-08-24",
      "evidence_level": "direct"
    },
    {
      "id": "christiania_theater_1857_1890",
      "claim": "Oppdag Kvadraturen dokumenterer at Johannes Brun var tilknyttet Christiania Theater fra 1857 til 1890.",
      "status": "verified",
      "source_url": "https://www.oppdagkvadraturen.no/stoppesteder/johannes-brun-brynjulf-bergslien",
      "source_location": "avsnittet om Bruns teaterkarriere",
      "source_type": "institutional",
      "temporal_status": "historical",
      "verified_at": "2026-08-24",
      "evidence_level": "direct"
    },
    {
      "id": "statue_on_bankplassen",
      "claim": "Oppdag Kvadraturen dokumenterer at Brynjulf Bergsliens bronsestatue av Johannes Brun står på Bankplassen ved Café Engebret, nær stedet der Christiania Theater lå.",
      "status": "verified",
      "source_url": "https://www.oppdagkvadraturen.no/stoppesteder/johannes-brun-brynjulf-bergslien",
      "source_location": "innledning og avsnittet Hvorfor er verket der?",
      "source_type": "institutional",
      "temporal_status": "historical",
      "verified_at": "2026-08-24",
      "evidence_level": "direct"
    }
  ],
  "field_claim_map": {
    "name": ["identity_and_lifespan"],
    "kindLabel": ["identity_and_lifespan"],
    "birth_date": ["identity_and_lifespan"],
    "death_date": ["identity_and_lifespan"],
    "year": ["christiania_theater_1857_1890"],
    "placeId": ["statue_on_bankplassen"],
    "places[bankplassen]": ["statue_on_bankplassen"]
  },
  "sentence_claim_map": {
    "desc": [
      {
        "sentence": 1,
        "claim_ids": ["identity_and_lifespan", "christiania_theater_1857_1890", "statue_on_bankplassen"]
      }
    ],
    "popupDesc": [
      {
        "sentence": 1,
        "claim_ids": ["identity_and_lifespan"]
      },
      {
        "sentence": 2,
        "claim_ids": ["christiania_theater_1857_1890"]
      },
      {
        "sentence": 3,
        "claim_ids": ["statue_on_bankplassen"]
      }
    ]
  },
  "completion": {
    "completed_under": "people_profile_v1.0",
    "claims_verified": "3/3",
    "fact_review": "passed",
    "editorial_review": "passed",
    "source_verified_at": "2026-08-24",
    "validator_version": "1.0.0",
    "current_status": "ready_people_v1"
  }
}
